{
  "schema_version": "1.0",
  "domain": "revolut-merchant-customer-subscription-surface",
  "thresholds": {
    "overall_min_pass_rate": 1,
    "require_critical_pass": true
  },
  "cases": [
    {
      "id": "rv_case_01",
      "phrase": "list customers",
      "expect": "revolut.merchant.customers.list.v1",
      "critical": true
    },
    {
      "id": "rv_case_02",
      "phrase": "create customers",
      "expect": "revolut.merchant.customers.create.v1",
      "critical": true
    },
    {
      "id": "rv_case_03",
      "phrase": "delete customers customers",
      "expect": "revolut.merchant.customers.delete_customers.v1",
      "critical": true
    },
    {
      "id": "rv_case_04",
      "phrase": "retrieve customers customers",
      "expect": "revolut.merchant.customers.retrieve_customers.v1",
      "critical": true
    },
    {
      "id": "rv_case_05",
      "phrase": "update customers customers",
      "expect": "revolut.merchant.customers.update_customers.v1",
      "critical": true
    },
    {
      "id": "rv_case_06",
      "phrase": "list payment methods customers",
      "expect": "revolut.merchant.customers.list_payment_methods.v1",
      "critical": true
    },
    {
      "id": "rv_case_07",
      "phrase": "delete payment methods customers",
      "expect": "revolut.merchant.customers.delete_payment_methods.v1",
      "critical": true
    },
    {
      "id": "rv_case_08",
      "phrase": "retrieve payment methods customers",
      "expect": "revolut.merchant.customers.retrieve_payment_methods.v1",
      "critical": true
    },
    {
      "id": "rv_case_09",
      "phrase": "update payment methods customers",
      "expect": "revolut.merchant.customers.update_payment_methods.v1",
      "critical": true
    },
    {
      "id": "rv_case_10",
      "phrase": "list subscription plans",
      "expect": "revolut.merchant.subscription_plans.list.v1",
      "critical": true
    },
    {
      "id": "rv_case_11",
      "phrase": "create subscription plans",
      "expect": "revolut.merchant.subscription_plans.create.v1",
      "critical": true
    },
    {
      "id": "rv_case_12",
      "phrase": "retrieve subscription plans subscription plans",
      "expect": "revolut.merchant.subscription_plans.retrieve_subscription_plans.v1",
      "critical": true
    }
  ]
}
