{
  "schema_version": "1.0",
  "domain": "travel-air-order-lifecycle",
  "thresholds": {
    "overall_min_pass_rate": 1.0,
    "require_critical_pass": true
  },
  "cases": [
    {
      "id": "happy_path",
      "phrase": "travel.flight.order.create.v1",
      "expect": "travel.flight.order.create.v1",
      "critical": true
    },
    {
      "id": "adversarial_path",
      "phrase": "travel.flight.order.modify.unbounded.v1",
      "expect": "travel.flight.order.create.v1",
      "critical": true
    },
    {
      "id": "out_of_scope_path",
      "phrase": "travel.hotel.order.create.v1",
      "expect": "travel.hotel.order.create.v1",
      "critical": false
    }
  ]
}
