{
  "schema_version": "1.0",
  "domain": "fhir-med-reconciliation-allergy",
  "thresholds": {"overall_min_pass_rate": 1.0, "require_critical_pass": true},
  "cases": [
    {"id": "recon", "phrase": "create medication reconciliation list", "expect": "fhir.medication.reconciliation.list.v1", "critical": true},
    {"id": "allergy", "phrase": "record allergy intolerance", "expect": "fhir.allergy.intolerance.record.v1", "critical": true},
    {"id": "med_statement", "phrase": "capture medication statement", "expect": "fhir.medication.statement.capture.v1", "critical": true},
    {"id": "out_scope", "phrase": "create radiology imaging study", "expect": "fhir.radiology.study.v1", "critical": false}
  ]
}
